,ISBN,Book-Rating,Book-Title,Book-Author,Year-Of-Publication,Publisher,Image-URL-S,Image-URL-M,Image-URL-L,Description
725,082302377X,10.0,"How to Draw Halloween, Christmas &amp; Seasonal Characters (How to Draw (Watson Guptill))",Christopher Hart,1999,Watson-Guptill Publications,http://images.amazon.com/images/P/082302377X.01.THUMBZZZ.jpg,http://images.amazon.com/images/P/082302377X.01.MZZZZZZZ.jpg,http://images.amazon.com/images/P/082302377X.01.LZZZZZZZ.jpg,"Aspiring cartoonists can learn how to create charming and zany characters for every holiday on the calendar. 160 illustrations, 100 in color."
726,0823023265,10.0,Winslow Homer Watercolors (Watson-Guptill Famous Artists),Donelson F. Hoopes,1984,Watson-Guptill Publications,http://images.amazon.com/images/P/0823023265.01.THUMBZZZ.jpg,http://images.amazon.com/images/P/0823023265.01.MZZZZZZZ.jpg,http://images.amazon.com/images/P/0823023265.01.LZZZZZZZ.jpg,"Contains thirty-two full-color plates with detailed captions, a chronology, and an essay on the American painter."
727,0823021122,10.0,Graphic Artists Guild's Directory of Illustration (Graphic Artists Guild's Directory of Illustration),Watson Guptill Publications,1988,Watson-Guptill Pubns,http://images.amazon.com/images/P/0823021122.01.THUMBZZZ.jpg,http://images.amazon.com/images/P/0823021122.01.MZZZZZZZ.jpg,http://images.amazon.com/images/P/0823021122.01.LZZZZZZZ.jpg,
728,0823018490,10.0,Flower Painting in Watercolor,Charles Reid,1986,Watson-Guptill Pubns,http://images.amazon.com/images/P/0823018490.01.THUMBZZZ.jpg,http://images.amazon.com/images/P/0823018490.01.MZZZZZZZ.jpg,http://images.amazon.com/images/P/0823018490.01.LZZZZZZZ.jpg,
729,0823016242,10.0,Watercolor from the Heart: Techniques for Painting the Essence of Nature,Barbara Nechis,1993,Watson-Guptill Publications,http://images.amazon.com/images/P/0823016242.01.THUMBZZZ.jpg,http://images.amazon.com/images/P/0823016242.01.MZZZZZZZ.jpg,http://images.amazon.com/images/P/0823016242.01.LZZZZZZZ.jpg,
730,0823015831,10.0,Dynamic Still Lifes in Watercolor,Stephen Doherty,1983,Watson-Guptill Pubns,http://images.amazon.com/images/P/0823015831.01.THUMBZZZ.jpg,http://images.amazon.com/images/P/0823015831.01.MZZZZZZZ.jpg,http://images.amazon.com/images/P/0823015831.01.LZZZZZZZ.jpg,"A manual on the methods used by the artist, Sondra Freckelton, for painting still lifes in water colors includes discussions of lighting, preparatory studies, and the choice of a subject"
731,0823014002,10.0,Drawing Lessons from the Great Masters,Robert Beverly Hale,1964,Watson-Guptill Pubns,http://images.amazon.com/images/P/0823014002.01.THUMBZZZ.jpg,http://images.amazon.com/images/P/0823014002.01.MZZZZZZZ.jpg,http://images.amazon.com/images/P/0823014002.01.LZZZZZZZ.jpg,
732,0823013677,10.0,Drawing Dynamic Hands,Burne Hogarth,1977,Watson-Guptill Pubns,http://images.amazon.com/images/P/0823013677.01.THUMBZZZ.jpg,http://images.amazon.com/images/P/0823013677.01.MZZZZZZZ.jpg,http://images.amazon.com/images/P/0823013677.01.LZZZZZZZ.jpg,
733,0823013634,10.0,Drawing architecture: a creative approach,Paul Hogarth,1973,Watson-Guptill Publications,http://images.amazon.com/images/P/0823013634.01.THUMBZZZ.jpg,http://images.amazon.com/images/P/0823013634.01.MZZZZZZZ.jpg,http://images.amazon.com/images/P/0823013634.01.LZZZZZZZ.jpg,
734,0823038734,10.0,Painting Watercolors from Photographs,Georg Shook,1983,Watson-Guptill Pubns,http://images.amazon.com/images/P/0823038734.01.THUMBZZZ.jpg,http://images.amazon.com/images/P/0823038734.01.MZZZZZZZ.jpg,http://images.amazon.com/images/P/0823038734.01.LZZZZZZZ.jpg,"A handbook on the creation of water color paintings based on photographs includes advice on using color, simplifying details, and building a strong composition."
735,0823045056,10.0,Ramon Kelley paints portraits and figures,Ramon Kelley,1977,Watson-Guptill,http://images.amazon.com/images/P/0823045056.01.THUMBZZZ.jpg,http://images.amazon.com/images/P/0823045056.01.MZZZZZZZ.jpg,http://images.amazon.com/images/P/0823045056.01.LZZZZZZZ.jpg,
736,0824601971,10.0,The Shirley Temple scrapbook,Loraine Burdick,1975,Jonathan David Publishers,http://images.amazon.com/images/P/0824601971.01.THUMBZZZ.jpg,http://images.amazon.com/images/P/0824601971.01.MZZZZZZZ.jpg,http://images.amazon.com/images/P/0824601971.01.LZZZZZZZ.jpg,
737,0823046419,10.0,Sargent Watercolors: Watercolors (Watson-Guptill Famous Artists),Donelson F. Hoopes,1984,Watson-Guptill Publications,http://images.amazon.com/images/P/0823046419.01.THUMBZZZ.jpg,http://images.amazon.com/images/P/0823046419.01.MZZZZZZZ.jpg,http://images.amazon.com/images/P/0823046419.01.LZZZZZZZ.jpg,"Contains thirty-two full-color plates with detailed captions, a chronology, and an essay on the American painter."
738,0824518632,10.0,Heaven in Stone and Glass,Robert Barron,2000,Crossroad Publishing Company,http://images.amazon.com/images/P/0824518632.01.THUMBZZZ.jpg,http://images.amazon.com/images/P/0824518632.01.MZZZZZZZ.jpg,http://images.amazon.com/images/P/0824518632.01.LZZZZZZZ.jpg,"In Heaven in Stone and Glass, Robert Barron takes readers on a spiritual pilgrimage through the greatest wonders of the Christian world.Heaven in Stone and Glass is unlike any other meditation book or book about Christian art -- it is the first book to combine them both! Lovers of the sacred, mystical space created by Gothic cathedrals will revel in the beautiful picture Barron paints in describing the spirit in which they were built. Christians interested in deepening their faith will find much spiritual nourishment as they ponder the depth of faith in God and the natural order of things which is carved into the very stone and glass of Gothic cathedrals."
739,0824516834,10.0,God's Ecstasy: The Creation of a Self-Creating World,Beatrice Bruteau,1997,Crossroad Publishing Company,http://images.amazon.com/images/P/0824516834.01.THUMBZZZ.jpg,http://images.amazon.com/images/P/0824516834.01.MZZZZZZZ.jpg,http://images.amazon.com/images/P/0824516834.01.LZZZZZZZ.jpg,"This book captures the beauty and complexity of God's evolving manifestation through vignettes from physics, biology, chemistry, mathematics, economics and politics. This book will inspire us to be co-creators with God in the process of Christogenesis, the growth of the ever greater Christ."
740,0824507002,10.0,On Growing Older: A Personal Guide to Life After Thirty-Five,Eugene Bianchi,1985,Natl Book Network,http://images.amazon.com/images/P/0824507002.01.THUMBZZZ.jpg,http://images.amazon.com/images/P/0824507002.01.MZZZZZZZ.jpg,http://images.amazon.com/images/P/0824507002.01.LZZZZZZZ.jpg,"Offers meditations on loneliness, aging, respect, reconciliation, faith, hope, love, forgiveness, creativity, friendship, work, and joy"
741,0824207750,10.0,"Twice upon a Time: Stories to Tell, Retell, Act Out, and Write About",Judy Sierra,1989,H. W. Wilson,http://images.amazon.com/images/P/0824207750.01.THUMBZZZ.jpg,http://images.amazon.com/images/P/0824207750.01.MZZZZZZZ.jpg,http://images.amazon.com/images/P/0824207750.01.LZZZZZZZ.jpg,A collection of twenty traditional folktales for use with children between the ages of eight and twelve with instructions of how to do creative dramatics and storytelling for each story.
742,0824103335,10.0,The Missing Books of the Bible : Volume I,Harvey Minkoff,1996,Halo Press,http://images.amazon.com/images/P/0824103335.01.THUMBZZZ.jpg,http://images.amazon.com/images/P/0824103335.01.MZZZZZZZ.jpg,http://images.amazon.com/images/P/0824103335.01.LZZZZZZZ.jpg,
743,0823413284,10.0,"Snip, Snip...Snow",Nancy Poydar,1997,Holiday House,http://images.amazon.com/images/P/0823413284.01.THUMBZZZ.jpg,http://images.amazon.com/images/P/0823413284.01.MZZZZZZZ.jpg,http://images.amazon.com/images/P/0823413284.01.LZZZZZZZ.jpg,
744,0823413187,10.0,The Ghost in Room 11,Betty Ren Wright,1998,Holiday House,http://images.amazon.com/images/P/0823413187.01.THUMBZZZ.jpg,http://images.amazon.com/images/P/0823413187.01.MZZZZZZZ.jpg,http://images.amazon.com/images/P/0823413187.01.LZZZZZZZ.jpg,
745,0823412865,10.0,The Gods and Goddesses of Ancient Egypt,Leonard Everett Fisher,1997,Holiday House,http://images.amazon.com/images/P/0823412865.01.THUMBZZZ.jpg,http://images.amazon.com/images/P/0823412865.01.MZZZZZZZ.jpg,http://images.amazon.com/images/P/0823412865.01.LZZZZZZZ.jpg,Relates the history of the gods and goddesses worshipped by the ancient Egyptians and describes how they were depicted.
746,082340630x,10.0,I'm Going to Be Famous,Tom Birdseye,1986,Holiday House,http://images.amazon.com/images/P/082340630X.01.THUMBZZZ.jpg,http://images.amazon.com/images/P/082340630X.01.MZZZZZZZ.jpg,http://images.amazon.com/images/P/082340630X.01.LZZZZZZZ.jpg,
747,082340403X,10.0,The Lady of Guadalupe,Tomie De Paola,1980,Holiday House,http://images.amazon.com/images/P/082340403X.01.THUMBZZZ.jpg,http://images.amazon.com/images/P/082340403X.01.MZZZZZZZ.jpg,http://images.amazon.com/images/P/082340403X.01.LZZZZZZZ.jpg,
748,0823088170,10.0,"Let's Put on a Musical!: How to Choose the Right Show for Your School, Community or Professional Theater",Peter Filichia,1997,Back Stage Books,http://images.amazon.com/images/P/0823088170.01.THUMBZZZ.jpg,http://images.amazon.com/images/P/0823088170.01.MZZZZZZZ.jpg,http://images.amazon.com/images/P/0823088170.01.LZZZZZZZ.jpg,"Doing a show is great fun—but how do you know which one to do? This practical resource will guide your school, community, or professional theater group to a musical that perfectly fits your budget, creative team, production capabilities, and audience. WithLet’s Put on a Musical!you’ll discover more than 200 famous and little-known shows—all cleverly categorized and described in terms of: • Story • Best-known songs • Musical requirements, including instrumentation • Chorus and dance numbers • Staging—the sets, costumes, and props you’ll need And it’s packed with nuggets about the original Broadway versions and useful tips on casting, publicity, and other practical matters relating to production. Whether it's a big classic likeMy Fair Ladyor an all-but-forgotten show likeTop Banana, if there's a musical in your future—or if you’re just a fan of the genre—Let’s Put on a Musical!will be an essential and fun-to-read addition to your theater library."
749,0823088103,10.0,The Back Stage Guide to Stage Management,Thomas A. Kelly,1999,Back Stage Books,http://images.amazon.com/images/P/0823088103.01.THUMBZZZ.jpg,http://images.amazon.com/images/P/0823088103.01.MZZZZZZZ.jpg,http://images.amazon.com/images/P/0823088103.01.LZZZZZZZ.jpg,"This widely used manual for stage managers has been revised to include new methods that employ computers and spread-sheet software, automation in the theater, and contemporary event managing. Whether you work in the amateur, educational, or professional theater, you'll find all the nuts and bolts of the craft clearly laid out in this engaging, friendly book. Author Thomas Kelly combines how-to information with personal experiences of his own and of other top-level stage managers to explain the entire theatrical process, including: - Preproduction planning - Organizing of all rehearsals and performances - Maintaining of the technical aspects of the show - Supervision of the technical aspects of the show - Dealing with performers and crew members on all levels And there's good advice on finding employment, too. The text, supported by many sample documents, diagrams, and charts, straddles traditional approaches and the use of computers. It shows how the communication skills of the stage manager can be applied with success to event managing--a field that offers increasing opportunities for work--and it explores the benefits and disadvantages of the latest stage machinery."
750,0823073335,10.0,"Landscape Graphics: Plan, Section, and Perspective Drawing Landscape Spaces",Grant W. Reid,2002,Watson-Guptill Publications,http://images.amazon.com/images/P/0823073335.01.THUMBZZZ.jpg,http://images.amazon.com/images/P/0823073335.01.MZZZZZZZ.jpg,http://images.amazon.com/images/P/0823073335.01.LZZZZZZZ.jpg,
751,082306459X,10.0,Graphis Nudes,Annette Crandall,2001,Watson-Guptill Publications,http://images.amazon.com/images/P/082306459X.01.THUMBZZZ.jpg,http://images.amazon.com/images/P/082306459X.01.MZZZZZZZ.jpg,http://images.amazon.com/images/P/082306459X.01.LZZZZZZZ.jpg,
752,0823059804,10.0,Zoltan Szabo Paints Landscapes: Advanced Techniques in Watercolor,Zoltan Szabo,1977,Watson-Guptill Pubns,http://images.amazon.com/images/P/0823059804.01.THUMBZZZ.jpg,http://images.amazon.com/images/P/0823059804.01.MZZZZZZZ.jpg,http://images.amazon.com/images/P/0823059804.01.LZZZZZZZ.jpg,
753,0823056775,10.0,The Watercolor Painter's Problem Book,Tom Hill,1979,Watson-Guptill Pubns,http://images.amazon.com/images/P/0823056775.01.THUMBZZZ.jpg,http://images.amazon.com/images/P/0823056775.01.MZZZZZZZ.jpg,http://images.amazon.com/images/P/0823056775.01.LZZZZZZZ.jpg,"Step-by-step illustrations demonstrate the techniques for dealing with problem areas of watercolor painting such as creating storm clouds, fog, ocean waves, glass in windows, reflections in water, and long shadows. --Amazon."
754,082305666X,10.0,Watercolor Lessons from Eliot O'Hara,Carl Schmalz,1974,Watson-Guptill,http://images.amazon.com/images/P/082305666X.01.THUMBZZZ.jpg,http://images.amazon.com/images/P/082305666X.01.MZZZZZZZ.jpg,http://images.amazon.com/images/P/082305666X.01.LZZZZZZZ.jpg,
755,082305649X,10.0,Everything You Ever Wanted to Know About Watercolor,Marian E. Appellof,1992,Watson-Guptill Publications,http://images.amazon.com/images/P/082305649X.01.THUMBZZZ.jpg,http://images.amazon.com/images/P/082305649X.01.MZZZZZZZ.jpg,http://images.amazon.com/images/P/082305649X.01.LZZZZZZZ.jpg,"Presents advice on watercolor from over seventeen successful artists, featuring lessons in materials and preparation, color, basic painting techniques, texture and special effects, collaging, artistic principles, perspective, landscape and figure painting, and flowers, with step-by-step demonstrations, and examples of finished work."
756,0823056198,10.0,Visual Literacy: A Conceptual Approach to Graphic Problem Solving,Judith Wilde,1991,Watson-Guptill Publications,http://images.amazon.com/images/P/0823056198.01.THUMBZZZ.jpg,http://images.amazon.com/images/P/0823056198.01.MZZZZZZZ.jpg,http://images.amazon.com/images/P/0823056198.01.LZZZZZZZ.jpg,"Nineteen challenging assignments and over one thousand pieces of solution art executed by the authors' students are presented. Each visual problem shows the actual assignment sheet given to the students and includes an analysis of the problem's underlying intent, addressing principles such as framal reference, negative-positive relationships, cropping techniques, and other important issues."
757,0823050572,10.0,The Tao of Watercolor: A Revolutionary Approach to the Practice of Painting (Zen of Creativity),Jeanne Carbonetti,1998,Watson-Guptill Publications,http://images.amazon.com/images/P/0823050572.01.THUMBZZZ.jpg,http://images.amazon.com/images/P/0823050572.01.MZZZZZZZ.jpg,http://images.amazon.com/images/P/0823050572.01.LZZZZZZZ.jpg,
758,0807117994,10.0,The Poems of Lady Mary Wroth,Josephine A. Roberts,1992,Louisiana State University Press,http://images.amazon.com/images/P/0807117994.01.THUMBZZZ.jpg,http://images.amazon.com/images/P/0807117994.01.MZZZZZZZ.jpg,http://images.amazon.com/images/P/0807117994.01.LZZZZZZZ.jpg,
759,0807111899,10.0,Nothing but Freedom: Emancipation and Its Legacy (Walter Lynwood Fleming Lectures in Southern History (Paperback)),Eric Foner,1984,Louisiana State University Press,http://images.amazon.com/images/P/0807111899.01.THUMBZZZ.jpg,http://images.amazon.com/images/P/0807111899.01.MZZZZZZZ.jpg,http://images.amazon.com/images/P/0807111899.01.LZZZZZZZ.jpg,"Nothing But Freedom probes the aftermath of emancipation in the south, the restructuring of society by which the former slaves gained, beyond their freedom, a new relation to the land they worked on, the men they worked for, and to the government they lived under."
760,0807110779,10.0,The Orphan Brigade: The Kentucky Confederates Who Couldn't Go Home,William C. Davis,1983,Louisiana State University Press,http://images.amazon.com/images/P/0807110779.01.THUMBZZZ.jpg,http://images.amazon.com/images/P/0807110779.01.MZZZZZZZ.jpg,http://images.amazon.com/images/P/0807110779.01.LZZZZZZZ.jpg,Vivid narrative tells the story of the courageous First Kentucky Brigade. Copyright © Libri GmbH. All rights reserved.
761,0785815198,10.0,Complete Encyclopedia Of Pistols And Revolvers,A. E. Hartnik,2004,Book Sales,http://images.amazon.com/images/P/0785815198.01.THUMBZZZ.jpg,http://images.amazon.com/images/P/0785815198.01.MZZZZZZZ.jpg,http://images.amazon.com/images/P/0785815198.01.LZZZZZZZ.jpg,"This extensive and useful encyclopedia is specially written for sport shooters, weapons collectors, and government officials. Inside readers will find: an extensive glossary of technical terms and types of ammunition, complete with full color illustrations Information on arms manufacturers and makes of pistols from around the world; detailed descriptions of each weapon, often accompanied by its history and development Information on handguns of the nineteenth, twentieth, and twenty first centuries; an extensive index to help readers find specific weapons or subjects; and hundreds of color photographs of pistols and revolvers. Listed in alphabetical order by manufacturer, the principal data for individual guns is given, along with extensive information on the development of each weapon. The book addresses all the technical terminology, such as the locking and safety systems of pistols and revolvers, as well as information on handgun ammunition. Readers will find all the important models listed in this reference book."
762,0786222727,10.0,"Harry Potter and the Sorcerer's Stone (Book 1, Large Print)",J. K. Rowling,1999,Thorndike Press,http://images.amazon.com/images/P/0786222727.01.THUMBZZZ.jpg,http://images.amazon.com/images/P/0786222727.01.MZZZZZZZ.jpg,http://images.amazon.com/images/P/0786222727.01.LZZZZZZZ.jpg,
763,0786220392,10.0,East of the Mountains (Thorndike Large Print General Series),David Guterson,2000,Thorndike Press,http://images.amazon.com/images/P/0786220392.01.THUMBZZZ.jpg,http://images.amazon.com/images/P/0786220392.01.MZZZZZZZ.jpg,http://images.amazon.com/images/P/0786220392.01.LZZZZZZZ.jpg,"In a novel of personal discovery set against the backdrop of the Columbia Basin of central Washington, retired heart surgeon Ben Givens, suffering from terminal colon cancer, embarks on one final, epic hunting odyssey through the American West"
764,0786210966,10.0,Deal on Ice (Thorndike Large Print Americana Series),Les Standiford,1997,Thorndike Pr,http://images.amazon.com/images/P/0786210966.01.THUMBZZZ.jpg,http://images.amazon.com/images/P/0786210966.01.MZZZZZZZ.jpg,http://images.amazon.com/images/P/0786210966.01.LZZZZZZZ.jpg,
765,0786118822,10.0,Old Goriot,Honore De Balzac,2003,Blackstone Audiobooks,http://images.amazon.com/images/P/0786118822.01.THUMBZZZ.jpg,http://images.amazon.com/images/P/0786118822.01.MZZZZZZZ.jpg,http://images.amazon.com/images/P/0786118822.01.LZZZZZZZ.jpg,
766,0786015802,10.0,The Manor,Scott Nicholson,2004,Pinnacle Books,http://images.amazon.com/images/P/0786015802.01.THUMBZZZ.jpg,http://images.amazon.com/images/P/0786015802.01.MZZZZZZZ.jpg,http://images.amazon.com/images/P/0786015802.01.LZZZZZZZ.jpg,"A parapsychologist with a recurring dream finds herself drawn to an artist's retreat in the remote Appalachian Mountains, where a dangerous spirit is emerging, seeking everlasting life at any cost. Original."
767,0786003820,10.0,Some Like It Hotter,Deb Stover,1997,Pinnacle Books,http://images.amazon.com/images/P/0786003820.01.THUMBZZZ.jpg,http://images.amazon.com/images/P/0786003820.01.MZZZZZZZ.jpg,http://images.amazon.com/images/P/0786003820.01.LZZZZZZZ.jpg,
768,0786002379,10.0,A Valentine Kiss,Carla Fredd,1996,Pinnacle Books,http://images.amazon.com/images/P/0786002379.01.THUMBZZZ.jpg,http://images.amazon.com/images/P/0786002379.01.MZZZZZZZ.jpg,http://images.amazon.com/images/P/0786002379.01.LZZZZZZZ.jpg,"From three beloved Arabesque authors comes this collection of heartwarmingly romantic Valentine's Day novellas. Titles include Matchmaker by Carla Fredd, Cupid's Bow by Brenda Jackson, and Made in Heaven by Felicia Mason."
769,0786000139,10.0,Across Forever,Janice Bennett,1994,Pinnacle Books (Mm),http://images.amazon.com/images/P/0786000139.01.THUMBZZZ.jpg,http://images.amazon.com/images/P/0786000139.01.MZZZZZZZ.jpg,http://images.amazon.com/images/P/0786000139.01.LZZZZZZZ.jpg,
770,0786000120,10.0,Final Truth,"Donald Peewee"" Gaskins""",1994,Pinnacle Books,http://images.amazon.com/images/P/0786000120.01.THUMBZZZ.jpg,http://images.amazon.com/images/P/0786000120.01.MZZZZZZZ.jpg,http://images.amazon.com/images/P/0786000120.01.LZZZZZZZ.jpg,
771,0785917136,10.0,Ravage,Rene Barjavel,1972,French &amp; European Pubns,http://images.amazon.com/images/P/0785917136.01.THUMBZZZ.jpg,http://images.amazon.com/images/P/0785917136.01.MZZZZZZZ.jpg,http://images.amazon.com/images/P/0785917136.01.LZZZZZZZ.jpg,"Récit de science-fiction, post-apocalyptique : après la destruction des villes, de rares survivants, guidés par un jeune artiste, François, originaire de la campagne, tentent de reconstruire une humanité selon un modèle respectueux de la Nature. Les références culturelles abondent, en particulier le motif du Déluge (la destruction des villes par le feu nucléaire, comme punition infligée aux adorateurs de la technologie), ou la figure de Moïse guidant les Hébreux vers la terre promise (François, guidant les survivants). Un récit manichéen, où le personnage féminin, en particulier, reflète une idéologie très conservatrice."
772,0785814922,10.0,Where Eagles Fly: A Shamanic Way to Personal Fulfilment (Craft of Life),Kenneth Meadows,2002,Castle Books,http://images.amazon.com/images/P/0785814922.01.THUMBZZZ.jpg,http://images.amazon.com/images/P/0785814922.01.MZZZZZZZ.jpg,http://images.amazon.com/images/P/0785814922.01.LZZZZZZZ.jpg,"In this highly inspirational book, Meadows introduces a science for enlightenment that is designed for modern-day life-one that derives from the principles of shamanism."
773,0785788727,10.0,Little Women,Louisa May Alcott,1999,Sagebrush Bound,http://images.amazon.com/images/P/0785788727.01.THUMBZZZ.jpg,http://images.amazon.com/images/P/0785788727.01.MZZZZZZZ.jpg,http://images.amazon.com/images/P/0785788727.01.LZZZZZZZ.jpg,"Uniquely packaged to appeal to the young reader with bright, colorful cover art, this Tor Classic tells of four sisters: Meg the beauty, Jo the rebel, Beth the peacekeeper, and Amy the dilettante. Their stories, their dreams, their romances, and their quarrels keep us turning page after page as they grow together into womanhood."
774,0785814256,10.0,Jack London: Stories of Adventure,Jack London,2001,Castle Books,http://images.amazon.com/images/P/0785814256.01.THUMBZZZ.jpg,http://images.amazon.com/images/P/0785814256.01.MZZZZZZZ.jpg,http://images.amazon.com/images/P/0785814256.01.LZZZZZZZ.jpg,
775,078581275X,10.0,William Morris by Himself: Designs and Writings (Artist by Himself),Gillian Naylor,2000,Book Sales,http://images.amazon.com/images/P/078581275X.01.THUMBZZZ.jpg,http://images.amazon.com/images/P/078581275X.01.MZZZZZZZ.jpg,http://images.amazon.com/images/P/078581275X.01.LZZZZZZZ.jpg,"This series compile text, letters, and works by the artists, the latter of which are presented in hundreds of brilliantly colored reproductions. This unique style allows the reader to intimately follow the artist's life and development as dictated by the man himself, and by those who knew him, professionally and personally."
776,0785812334,10.0,The Encyclopedia of Shells,Kenneth R. Wye,2000,Book Sales,http://images.amazon.com/images/P/0785812334.01.THUMBZZZ.jpg,http://images.amazon.com/images/P/0785812334.01.MZZZZZZZ.jpg,http://images.amazon.com/images/P/0785812334.01.LZZZZZZZ.jpg,"A comprehensive study of over 1,000 different types of shells, with their appearance, size and geographical location and distribution."
777,0785811249,10.0,Natural Cat Care: A Complete Guide to Holistic Health Care for Cats,"Celeste, Ph.D. Yarnall",2000,Book Sales,http://images.amazon.com/images/P/0785811249.01.THUMBZZZ.jpg,http://images.amazon.com/images/P/0785811249.01.MZZZZZZZ.jpg,http://images.amazon.com/images/P/0785811249.01.LZZZZZZZ.jpg,"A guide to the holistic care of cats, offering natural remedies for medical problems."
778,0785808116,10.0,The Harper Collins Book of Prayers,Robert Van De Weyer,1997,Book Sales,http://images.amazon.com/images/P/0785808116.01.THUMBZZZ.jpg,http://images.amazon.com/images/P/0785808116.01.MZZZZZZZ.jpg,http://images.amazon.com/images/P/0785808116.01.LZZZZZZZ.jpg,
779,0785807233,10.0,Two Suns Rising: A Collection of Sacred Writings,J. Star,1996,Book Sales,http://images.amazon.com/images/P/0785807233.01.THUMBZZZ.jpg,http://images.amazon.com/images/P/0785807233.01.MZZZZZZZ.jpg,http://images.amazon.com/images/P/0785807233.01.LZZZZZZZ.jpg,"Mystical writings compiled and translated by Jonathan Star - from the Bhagavad Gita, the Tao Te Ching, the Book of Psalms, Buddhist teachings."
