,ISBN,Book-Rating,Book-Title,Book-Author,Year-Of-Publication,Publisher,Image-URL-S,Image-URL-M,Image-URL-L,Description
170,0814792685,10.0,Heavenly Sex: Sexuality in the Jewish Tradition,Ruth K. Westheimer,1996,New York University Press,http://images.amazon.com/images/P/0814792685.01.THUMBZZZ.jpg,http://images.amazon.com/images/P/0814792685.01.MZZZZZZZ.jpg,http://images.amazon.com/images/P/0814792685.01.LZZZZZZZ.jpg,"Dr. Ruth bridges the gap between sex and religion. In this light-hearted, lively tour of sexuality within Jewish religion and culture, Dr. Ruth Westheimer and Jonathan Mark team up to reveal how, contrary to popular wisdom, the Jewish tradition is much more progressive in many regards than one might think. Applying Dr. Ruth's unique brand of couples therapy to such Biblical relationships as Abraham and Sarah, and Joseph and Potiphar's wife, the authors enlist Biblical lore to cover such topics as surrogacy, incest, and arranged marriages. They offer a clearer understanding of the intertwining relationships between sexuality, spirituality, and sexual roles through a look at the latter books of the Bible—The Song of Songs, Ruth, Proverbs, Psalms, and some of the bawdier tales of the Prophets. One chapter provides a provocative metaphorical perspective on the Sabbath as a weekly revival, highlighting not only its spiritual, but its marital and sexual aspects as well. Focusing specifically on Orthodox forms of Judaism and offering Dr. Ruth's singular interpretations, the book answers such questions as: What night of the week is best for making love? How often should couples have sex? Can traditional Jewish notions of sex and sexuality be reconciled with contemporary beliefs? What roles can and do dreams and fantasy play? Heavenly Sex familiarizes the reader with a generous and lusty religious tradition that has too often been lost within the rubric of a larger Christian culture with a completely different view of sexuality."
171,081631649X,10.0,Eleventh Hour,Celeste Perino Walker,1998,Pacific Press Publishing Association,http://images.amazon.com/images/P/081631649X.01.THUMBZZZ.jpg,http://images.amazon.com/images/P/081631649X.01.MZZZZZZZ.jpg,http://images.amazon.com/images/P/081631649X.01.LZZZZZZZ.jpg,
172,0814807518,10.0,Homage to Yaacov Agam (Amiel),Not Applicable (Na ),1981,Book Sales,http://images.amazon.com/images/P/0814807518.01.THUMBZZZ.jpg,http://images.amazon.com/images/P/0814807518.01.MZZZZZZZ.jpg,http://images.amazon.com/images/P/0814807518.01.LZZZZZZZ.jpg,An Israeli sculptor and experimental artist best known for his contributions to optical and kinetic art.
173,0816308446,10.0,The Great Controversy,E. G. White,1950,Pacific Press Publishing Association,http://images.amazon.com/images/P/0816308446.01.THUMBZZZ.jpg,http://images.amazon.com/images/P/0816308446.01.MZZZZZZZ.jpg,http://images.amazon.com/images/P/0816308446.01.LZZZZZZZ.jpg,"""Carries the story of the controversy between God and Satan to its ultimate and glorious conclusion. Beginning with the destruction of Jerusalem and continuing through the persecutions of Christians in the Roman Empire, the apostasy of the Dark Ages, the shining light of the Reformation, and the worldwide religious awakening of the nineteenth century, this volume traces the conflict into the future, to the Second Coming of Jesus and the glories of the earth made new. As the end draws ever closer, the vital issue of loyalty to God will become decisive. In this concluding volume, the author powerfully points out the principles involved in the impending conflict and how each person can stand firmly for God and His truth""--Back cover."
174,0816305250,10.0,Great Controversy: Between Christ and Satan,Ellen Gould Harmon White,1982,Shelter Publications,http://images.amazon.com/images/P/0816305250.01.THUMBZZZ.jpg,http://images.amazon.com/images/P/0816305250.01.MZZZZZZZ.jpg,http://images.amazon.com/images/P/0816305250.01.LZZZZZZZ.jpg,"""Carries the story of the controversy between God and Satan to its ultimate and glorious conclusion. Beginning with the destruction of Jerusalem and continuing through the persecutions of Christians in the Roman Empire, the apostasy of the Dark Ages, the shining light of the Reformation, and the worldwide religious awakening of the nineteenth century, this volume traces the conflict into the future, to the Second Coming of Jesus and the glories of the earth made new. As the end draws ever closer, the vital issue of loyalty to God will become decisive. In this concluding volume, the author powerfully points out the principles involved in the impending conflict and how each person can stand firmly for God and His truth""--Back cover."
175,081616228X,10.0,Great Train Robbery,Michael Crichton,1975,Thorndike Pr,http://images.amazon.com/images/P/081616228X.01.THUMBZZZ.jpg,http://images.amazon.com/images/P/081616228X.01.MZZZZZZZ.jpg,http://images.amazon.com/images/P/081616228X.01.LZZZZZZZ.jpg,"One of Crichton's classic thrillers--the ""New York Times"" bestseller which was the basis for the 1979 film adapted and directed by the author--is reissued with a new look. In 1855 London, a group of thieves plan a daring robbery of gold bullion cargo aboard a mighty steam locomotive as it speeds along the English countryside. Reissue. Copyright © Libri GmbH. All rights reserved."
176,0816151091,10.0,The Dark Half (G.K. Hall Large Print Book Series),Stephen King,1991,Thorndike Pr,http://images.amazon.com/images/P/0816151091.01.THUMBZZZ.jpg,http://images.amazon.com/images/P/0816151091.01.MZZZZZZZ.jpg,http://images.amazon.com/images/P/0816151091.01.LZZZZZZZ.jpg,"Evidence indicates that Thad Beaumont whose novels seem to be the product of a twisted imagination, may just be quilty of a series of monstrous murders. Copyright © Libri GmbH. All rights reserved."
177,081614849X,10.0,What Do You Care What Other People Think?: Further Adventures of a Curious Character (G.K. Hall Large Print Book Series),Richard P. Feynman,1990,G. K. Hall &amp; Company,http://images.amazon.com/images/P/081614849X.01.THUMBZZZ.jpg,http://images.amazon.com/images/P/081614849X.01.MZZZZZZZ.jpg,http://images.amazon.com/images/P/081614849X.01.LZZZZZZZ.jpg,"The late Nobel Prize-winning scientist reveals the influences in his life and discusses his role in the investigation of the ""Challenger"" explosion"
178,0816147736,10.0,Brief History of Time: From the Big Bang to Black Holes (General Large Print),Stephen W. Hawking,1989,Thorndike Pr,http://images.amazon.com/images/P/0816147736.01.THUMBZZZ.jpg,http://images.amazon.com/images/P/0816147736.01.MZZZZZZZ.jpg,http://images.amazon.com/images/P/0816147736.01.LZZZZZZZ.jpg,
179,0816047022,10.0,In Search of the Dark Ages,Michael Wood,2001,Facts on File,http://images.amazon.com/images/P/0816047022.01.THUMBZZZ.jpg,http://images.amazon.com/images/P/0816047022.01.MZZZZZZZ.jpg,http://images.amazon.com/images/P/0816047022.01.LZZZZZZZ.jpg,"Focusing on Great Britain, this study of the centuries following the Roman Empire's demise discusses new archaeological discoveries and, based on these discoveries, reconstructs significant events and personalities of the Dark Ages."
180,0816040575,10.0,Facts on File Dictionary of Cultural and Historical Allusions: From the Middle Ages Through the 20th Century (Facts on File Library of Language and Literature),Sylvia Cole,2000,Facts on File,http://images.amazon.com/images/P/0816040575.01.THUMBZZZ.jpg,http://images.amazon.com/images/P/0816040575.01.MZZZZZZZ.jpg,http://images.amazon.com/images/P/0816040575.01.LZZZZZZZ.jpg,"Explains more than 1,500 words and expressions from literature, art, history, politics, sports, film, and popular culture, which have transcended their original meanings to refer to other attributes or circumstances."
181,081603723X,10.0,"Religions of the World: The Illustrated Guide to Origins, Beliefs, Traditions &amp; Festivals",Elizabeth Breuilly,1997,Facts on File,http://images.amazon.com/images/P/081603723X.01.THUMBZZZ.jpg,http://images.amazon.com/images/P/081603723X.01.MZZZZZZZ.jpg,http://images.amazon.com/images/P/081603723X.01.LZZZZZZZ.jpg,
182,081603494X,10.0,Word Dance: The Language of Native American Culture,Carl Waldman,1996,Facts on File,http://images.amazon.com/images/P/081603494X.01.THUMBZZZ.jpg,http://images.amazon.com/images/P/081603494X.01.MZZZZZZZ.jpg,http://images.amazon.com/images/P/081603494X.01.LZZZZZZZ.jpg,"This extraordinary work covers every aspect of Native American Culture. Entries provide brief definitions, information about language usage, relevance in Native American history, alternate spellings, and numerous cross-references to related subjects."
183,0816027722,10.0,The Guinness Book of Records 1492: The World Five Hundred Years Ago,Deborah Manley,1992,Facts on File,http://images.amazon.com/images/P/0816027722.01.THUMBZZZ.jpg,http://images.amazon.com/images/P/0816027722.01.MZZZZZZZ.jpg,http://images.amazon.com/images/P/0816027722.01.LZZZZZZZ.jpg,"Describes thousands of records from the time of Columbus, from astrology to zoos, from Greenland to the Cape of Good Hope, and from China to Peru"
184,0816021597,10.0,Encyclopedia of Wood: A Tree-By-Tree Guide to the World's Most Valuable Resource,William Lincoln,1989,Facts on File,http://images.amazon.com/images/P/0816021597.01.THUMBZZZ.jpg,http://images.amazon.com/images/P/0816021597.01.MZZZZZZZ.jpg,http://images.amazon.com/images/P/0816021597.01.LZZZZZZZ.jpg,
185,0816011680,10.0,The Encyclopedia of Superheroes,Jeff Rovin,1985,Facts on File,http://images.amazon.com/images/P/0816011680.01.THUMBZZZ.jpg,http://images.amazon.com/images/P/0816011680.01.MZZZZZZZ.jpg,http://images.amazon.com/images/P/0816011680.01.LZZZZZZZ.jpg,"Here is a dictionary of more than 1,000 superheroes culled from mythology, TV, movies, literature, and (chiefly) comic books."
186,0815713088,10.0,Preventive Defense: A New Security Strategy for America,Ashton B. Carter,1999,Brookings Institution Press,http://images.amazon.com/images/P/0815713088.01.THUMBZZZ.jpg,http://images.amazon.com/images/P/0815713088.01.MZZZZZZZ.jpg,http://images.amazon.com/images/P/0815713088.01.LZZZZZZZ.jpg,"William J. Perry and Ashton B. Carter draw on their experience as leaders of the U.S. Defense Department to propose a new American security strategy for the twenty-first century. After a century in which aggression had to be defeated in two world wars and then deterred through a prolonged cold war, the authors argue for a strategy centered on prevention. The authors' preventive defense strategy concentrates on the dangers that, if mismanaged, have the potential to grow into true threats to U.S. survival in the next century. They also argue for better management of the defense establishment so the United States will retain a strong military prepared to cope with all contingencies deter aggressors and win a conflict it deterrence faits."
187,0815604785,10.0,"The Last Lullaby: Poetry from the Holocaust (Religion, Theology and the Holocaust)",Aaron Kramer,1998,Syracuse University Press,http://images.amazon.com/images/P/0815604785.01.THUMBZZZ.jpg,http://images.amazon.com/images/P/0815604785.01.MZZZZZZZ.jpg,http://images.amazon.com/images/P/0815604785.01.LZZZZZZZ.jpg,"Kramer presents the horror of the genocide and the spirit of those who resisted in this collection of poems. Placing each group in historic and literary context with introductory essays, the poets - originally writing in Yiddish - speak from the ghettos, way-stations, and the death camps."
188,0815601816,10.0,Khul-Khaal: Five Egyptian Women Tell Their Stories (Contemporary Issues in the Middle East (Paperback)),Nayra Atiya,1982,Syracuse University Press,http://images.amazon.com/images/P/0815601816.01.THUMBZZZ.jpg,http://images.amazon.com/images/P/0815601816.01.MZZZZZZZ.jpg,http://images.amazon.com/images/P/0815601816.01.LZZZZZZZ.jpg,
189,0815410719,10.0,Rebel,Donald Spoto,2000,Cooper Square Publishers,http://images.amazon.com/images/P/0815410719.01.THUMBZZZ.jpg,http://images.amazon.com/images/P/0815410719.01.MZZZZZZZ.jpg,http://images.amazon.com/images/P/0815410719.01.LZZZZZZZ.jpg,
190,0815332181,10.0,"Molecular Biology of the Cell, Fourth Edition",Bruce Alberts,2002,Garland Science,http://images.amazon.com/images/P/0815332181.01.THUMBZZZ.jpg,http://images.amazon.com/images/P/0815332181.01.MZZZZZZZ.jpg,http://images.amazon.com/images/P/0815332181.01.LZZZZZZZ.jpg,
191,0815323034,10.0,The New Arthurian Encyclopedia (Updated Paperback Edition),Norris J. Lacy,1995,Garland Publishing,http://images.amazon.com/images/P/0815323034.01.THUMBZZZ.jpg,http://images.amazon.com/images/P/0815323034.01.MZZZZZZZ.jpg,http://images.amazon.com/images/P/0815323034.01.LZZZZZZZ.jpg,"First Published in 1996. Routledge is an imprint of Taylor & Francis, an informa company."
192,0815171161,10.0,"Drugs, Society, and Human Behavior",Oakley Ray,1995,McGraw Hill College Div,http://images.amazon.com/images/P/0815171161.01.THUMBZZZ.jpg,http://images.amazon.com/images/P/0815171161.01.MZZZZZZZ.jpg,http://images.amazon.com/images/P/0815171161.01.LZZZZZZZ.jpg,"The long-time market leader, this book examines drugs from all perspectives, including behavioral, pharmacological, historical, social, legal, and clinical. The book provides current facts and information, and is designed as well to assist in making well-informed decisions about personal behaviors."
193,081490890X,10.0,To Think That I Saw It on Mulberry Street,Dr Seuss,1987,Vanguard Press,http://images.amazon.com/images/P/081490890X.01.THUMBZZZ.jpg,http://images.amazon.com/images/P/081490890X.01.MZZZZZZZ.jpg,http://images.amazon.com/images/P/081490890X.01.LZZZZZZZ.jpg,"""A boy imagines a series of incredible sights on his way home from school so that he will have an interesting report to give his father""--Title page verso."
194,0811831914,10.0,Be a Bad Girl: A Journal,Tuttle Cameron,2001,Chronicle Books,http://images.amazon.com/images/P/0811831914.01.THUMBZZZ.jpg,http://images.amazon.com/images/P/0811831914.01.MZZZZZZZ.jpg,http://images.amazon.com/images/P/0811831914.01.LZZZZZZZ.jpg,
195,0811830829,10.0,Cocktail Hour,Babs Harrison,2001,Chronicle Books,http://images.amazon.com/images/P/0811830829.01.THUMBZZZ.jpg,http://images.amazon.com/images/P/0811830829.01.MZZZZZZZ.jpg,http://images.amazon.com/images/P/0811830829.01.LZZZZZZZ.jpg,"It's cocktail hour! This ebook features 50 timeless drink recipes—from the sophisticated Manhattan and Mint Julep to the seductive Tequila Sunrise and Mai Tai—plus offers tips on ambiance, bar essentials, mood music, and more. Whether you're imbibing A deux or making martinis by the dozen, make sure youre the host with the most at your next soiree."
196,0809463172,10.0,Psychic Voyages (Mysteries of the Unknown),Time Life Books,1988,Time-Life Books Inc,http://images.amazon.com/images/P/0809463172.01.THUMBZZZ.jpg,http://images.amazon.com/images/P/0809463172.01.MZZZZZZZ.jpg,http://images.amazon.com/images/P/0809463172.01.LZZZZZZZ.jpg,"Explores the phenomenon of near-death experiences, examining different theories on why they occur."
197,0809463857,10.0,Search for the Soul,Time-Life Books,1990,Time-Life Books,http://images.amazon.com/images/P/0809463857.01.THUMBZZZ.jpg,http://images.amazon.com/images/P/0809463857.01.MZZZZZZZ.jpg,http://images.amazon.com/images/P/0809463857.01.LZZZZZZZ.jpg,Donated.
198,0809463644,10.0,Transformations (Mysteries of the Unknown),Time Life Books,1995,Warner Books,http://images.amazon.com/images/P/0809463644.01.THUMBZZZ.jpg,http://images.amazon.com/images/P/0809463644.01.MZZZZZZZ.jpg,http://images.amazon.com/images/P/0809463644.01.LZZZZZZZ.jpg,"Examines the phenomena of werewolves, vampires, feral children, and other legendary monsters reported throughout history."
199,0809463490,10.0,Ancient Wisdom and Secret Sects (Mysteries of the Unknown Series),Time-Life Books,1989,Time-Life Books,http://images.amazon.com/images/P/0809463490.01.THUMBZZZ.jpg,http://images.amazon.com/images/P/0809463490.01.MZZZZZZZ.jpg,http://images.amazon.com/images/P/0809463490.01.LZZZZZZZ.jpg,Examines many secret societies and secret initiations both from the past and the present.
200,0809463415,10.0,Cosmic Connections (Mysteries of the Unknown Series),Time-Life Books,1988,Time-Life Books,http://images.amazon.com/images/P/0809463415.01.THUMBZZZ.jpg,http://images.amazon.com/images/P/0809463415.01.MZZZZZZZ.jpg,http://images.amazon.com/images/P/0809463415.01.LZZZZZZZ.jpg,"An examination of the uses, history, and nature of astrology."
201,0809463377,10.0,Mind Over Matter (Mysteries of the Unknown Series),Time-Life Books,1988,Time-Life Books,http://images.amazon.com/images/P/0809463377.01.THUMBZZZ.jpg,http://images.amazon.com/images/P/0809463377.01.MZZZZZZZ.jpg,http://images.amazon.com/images/P/0809463377.01.LZZZZZZZ.jpg,"Examines paranormal phenomena such as poltergeists, psychokinesis, and mind control."
202,0809463334,10.0,Mysterious Creatures (Mysteries of the Unknown Series),Time-Life Books,1988,Time-Life Books,http://images.amazon.com/images/P/0809463334.01.THUMBZZZ.jpg,http://images.amazon.com/images/P/0809463334.01.MZZZZZZZ.jpg,http://images.amazon.com/images/P/0809463334.01.LZZZZZZZ.jpg,An examination of the legends and history of strange creatures.
203,080946313X,10.0,Mystic Places (Mysteries of the Unknown),Time Life Books,1987,Time-Life Books Inc,http://images.amazon.com/images/P/080946313X.01.THUMBZZZ.jpg,http://images.amazon.com/images/P/080946313X.01.MZZZZZZZ.jpg,http://images.amazon.com/images/P/080946313X.01.LZZZZZZZ.jpg,Examines the history and nature of seemingly paranormal phenomena.
204,0809415143,10.0,Women (The Old West),Time-Life Books.,1978,Warner Books Inc,http://images.amazon.com/images/P/0809415143.01.THUMBZZZ.jpg,http://images.amazon.com/images/P/0809415143.01.MZZZZZZZ.jpg,http://images.amazon.com/images/P/0809415143.01.LZZZZZZZ.jpg,Text and illustrations present a portrait of the industrious women who helped settle the West.
205,0809448890,10.0,Dinosaurs (A Child's First Library of Learning),Time-Life Books,1989,Time-Life Books,http://images.amazon.com/images/P/0809448890.01.THUMBZZZ.jpg,http://images.amazon.com/images/P/0809448890.01.MZZZZZZZ.jpg,http://images.amazon.com/images/P/0809448890.01.LZZZZZZZ.jpg,"Questions and answers provide information about the behavior and possible fate of dinosaurs. Includes charts, diagrams, and an activities section."
206,0809448777,10.0,Wild Animals (A Child's First Library of Learning),Time-Life Books,1989,Time-Life Books,http://images.amazon.com/images/P/0809448777.01.THUMBZZZ.jpg,http://images.amazon.com/images/P/0809448777.01.MZZZZZZZ.jpg,http://images.amazon.com/images/P/0809448777.01.LZZZZZZZ.jpg,"Questions and answers provide information on the behavior and life cycles of such animals as giraffes, leopards, skunks, elephants, and alligators. Includes charts, diagrams, and an activities section."
207,0809448653,10.0,Everyday Life (A Child's First Library of Learning),Time-Life Books,1990,Time-Life Books,http://images.amazon.com/images/P/0809448653.01.THUMBZZZ.jpg,http://images.amazon.com/images/P/0809448653.01.MZZZZZZZ.jpg,http://images.amazon.com/images/P/0809448653.01.LZZZZZZZ.jpg,
208,0809429004,10.0,Breads (The Good Cook Series),Time Life,1981,Warner Books Inc,http://images.amazon.com/images/P/0809429004.01.THUMBZZZ.jpg,http://images.amazon.com/images/P/0809429004.01.MZZZZZZZ.jpg,http://images.amazon.com/images/P/0809429004.01.LZZZZZZZ.jpg,"Demonstrates the fundamental techniques of making breads, rolls, doughnuts, pretzels, pancakes, waffles, and pastries and offers a variety of recipes for baking them"
209,0809428660,10.0,The Good Cook: Soups,Time-Life Books.,1980,Warner Books Inc,http://images.amazon.com/images/P/0809428660.01.THUMBZZZ.jpg,http://images.amazon.com/images/P/0809428660.01.MZZZZZZZ.jpg,http://images.amazon.com/images/P/0809428660.01.LZZZZZZZ.jpg,
210,080942858X,10.0,"Vegetables: The Good Cook, Techniques and Recipes",Time-Life Books.,1979,Warner Books Inc,http://images.amazon.com/images/P/080942858X.01.THUMBZZZ.jpg,http://images.amazon.com/images/P/080942858X.01.MZZZZZZZ.jpg,http://images.amazon.com/images/P/080942858X.01.LZZZZZZZ.jpg,"Presents vegetables and their culinary preparation, including boiling and steaming, frying, braising and stewing, baking, broiling and grilling, Includes 72 pages of recipes."
211,0809428504,10.0,Poultry (The Good Cook Series),Time-Life Editors,1979,Warner Books Inc,http://images.amazon.com/images/P/0809428504.01.THUMBZZZ.jpg,http://images.amazon.com/images/P/0809428504.01.MZZZZZZZ.jpg,http://images.amazon.com/images/P/0809428504.01.LZZZZZZZ.jpg,
212,0809423103,10.0,Gamblers (Kivar),Robert Wallace,1978,Warner Books Inc,http://images.amazon.com/images/P/0809423103.01.THUMBZZZ.jpg,http://images.amazon.com/images/P/0809423103.01.MZZZZZZZ.jpg,http://images.amazon.com/images/P/0809423103.01.LZZZZZZZ.jpg,Examines the history of gambling in the American West and discusses numerous gamblers and the games they played.
213,0809423022,10.0,The Mexican War (Old West),David Nevin,1978,Warner Books Inc,http://images.amazon.com/images/P/0809423022.01.THUMBZZZ.jpg,http://images.amazon.com/images/P/0809423022.01.MZZZZZZZ.jpg,http://images.amazon.com/images/P/0809423022.01.LZZZZZZZ.jpg,
214,0809415437,10.0,The Canadians,Ogden Tanner,1977,Warner Books Inc,http://images.amazon.com/images/P/0809415437.01.THUMBZZZ.jpg,http://images.amazon.com/images/P/0809415437.01.MZZZZZZZ.jpg,http://images.amazon.com/images/P/0809415437.01.LZZZZZZZ.jpg,"Discusses the exploration, settlement, and development of Canada from the seventeenth century to the end of the nineteenth."
215,0809467542,10.0,The Country Kitchen (American Country),Time Life,1988,Warner Books Inc,http://images.amazon.com/images/P/0809467542.01.THUMBZZZ.jpg,http://images.amazon.com/images/P/0809467542.01.MZZZZZZZ.jpg,http://images.amazon.com/images/P/0809467542.01.LZZZZZZZ.jpg,Presents ideas and information about furnishing a country kitchen.
216,0809467585,10.0,Country Decorating (American Country),Time Life,1989,Warner Books Inc,http://images.amazon.com/images/P/0809467585.01.THUMBZZZ.jpg,http://images.amazon.com/images/P/0809467585.01.MZZZZZZZ.jpg,http://images.amazon.com/images/P/0809467585.01.LZZZZZZZ.jpg,"Looks at colors, fabrics, curtains, bedcovers, furniture, and wall and floor treatments that create a rustic appearance"
217,0809467623,10.0,"Country Quilts: Styles, Patterns, and Techniques from Past to Present (American Country)",Time Life,1989,Warner Books Inc,http://images.amazon.com/images/P/0809467623.01.THUMBZZZ.jpg,http://images.amazon.com/images/P/0809467623.01.MZZZZZZZ.jpg,http://images.amazon.com/images/P/0809467623.01.LZZZZZZZ.jpg,"Shows a variety of traditional American quilts and tells how to buy, display, and store quilts"
218,0810909405,10.0,Flowering trees and shrubs: The botanical paintings of Esther Heins,Judith Leet,1987,Abrams,http://images.amazon.com/images/P/0810909405.01.THUMBZZZ.jpg,http://images.amazon.com/images/P/0810909405.01.MZZZZZZZ.jpg,http://images.amazon.com/images/P/0810909405.01.LZZZZZZZ.jpg,
219,0810909340,10.0,Fifty Years of American Poetry: Anniversary Volume for the Academy of American Poets,Robert Penn Warren,1984,Harry N Abrams Inc,http://images.amazon.com/images/P/0810909340.01.THUMBZZZ.jpg,http://images.amazon.com/images/P/0810909340.01.MZZZZZZZ.jpg,http://images.amazon.com/images/P/0810909340.01.LZZZZZZZ.jpg,"This collection of poems by 126 recipients of grants from the Academy of American Poets. This anthology offers a definitive overview of the past five decades of American poetry, encompassing works by Aiken, Auden, Sandburg, Ashbery, Updike, Gilpin, and others."
220,0810909014,10.0,Faeries,David Larkin,1995,Harry N Abrams,http://images.amazon.com/images/P/0810909014.01.THUMBZZZ.jpg,http://images.amazon.com/images/P/0810909014.01.MZZZZZZZ.jpg,http://images.amazon.com/images/P/0810909014.01.LZZZZZZZ.jpg,"Edited by David Larkin. Two talented artists explore the world of faeries in myths, legends, and folklore."
221,0810908123,10.0,Walt Disney's Treasury of Children's Classics,Walt Disney Productions,1978,Harry N Abrams Inc,http://images.amazon.com/images/P/0810908123.01.THUMBZZZ.jpg,http://images.amazon.com/images/P/0810908123.01.MZZZZZZZ.jpg,http://images.amazon.com/images/P/0810908123.01.LZZZZZZZ.jpg,"Retells seventeen well-known fairy tales, folk tales, and short stories illustrated with scenes from Walt Disney films. Includes a behind-the-scenes look at the production of animated films."
222,0810908115,10.0,Disneyland: Inside Story,Randy Bright,1987,Harry N Abrams Inc,http://images.amazon.com/images/P/0810908115.01.THUMBZZZ.jpg,http://images.amazon.com/images/P/0810908115.01.MZZZZZZZ.jpg,http://images.amazon.com/images/P/0810908115.01.LZZZZZZZ.jpg,"Traces the development of Disneyland, and tells the story behind each ride and attraction at the theme park"
223,0810906643,10.0,Broadway musicals,Martin Gottfried,1979,H. N. Abrams,http://images.amazon.com/images/P/0810906643.01.THUMBZZZ.jpg,http://images.amazon.com/images/P/0810906643.01.MZZZZZZZ.jpg,http://images.amazon.com/images/P/0810906643.01.LZZZZZZZ.jpg,
224,0810834340,10.0,Playin' Around,Jennifer Ember Pierce,1998,Rowman &amp; Littlefield (Non NBN),http://images.amazon.com/images/P/0810834340.01.THUMBZZZ.jpg,http://images.amazon.com/images/P/0810834340.01.MZZZZZZZ.jpg,http://images.amazon.com/images/P/0810834340.01.LZZZZZZZ.jpg,
225,0810816067,10.0,August Derleth: A Bibliography (Scarecrow Author Bibliographies),Alison Morley Wilson,1983,Rowman &amp; Littlefield Pub Inc,http://images.amazon.com/images/P/0810816067.01.THUMBZZZ.jpg,http://images.amazon.com/images/P/0810816067.01.MZZZZZZZ.jpg,http://images.amazon.com/images/P/0810816067.01.LZZZZZZZ.jpg,
