,ISBN,Book-Rating,Book-Title,Book-Author,Year-Of-Publication,Publisher,Image-URL-S,Image-URL-M,Image-URL-L,Description
408,0834801175,10.0,The Living Buddha: An Interpretive Biography,Daisaku Ikeda,1975,Weatherhill,http://images.amazon.com/images/P/0834801175.01.THUMBZZZ.jpg,http://images.amazon.com/images/P/0834801175.01.MZZZZZZZ.jpg,http://images.amazon.com/images/P/0834801175.01.LZZZZZZZ.jpg,
409,0836210581,10.0,Affirmations,Cathy Guisewite,1996,Andrews McMeel Publishing,http://images.amazon.com/images/P/0836210581.01.THUMBZZZ.jpg,http://images.amazon.com/images/P/0836210581.01.MZZZZZZZ.jpg,http://images.amazon.com/images/P/0836210581.01.LZZZZZZZ.jpg,"Designed to generate impulse sales, titles in this line are carefully balanced for gift giving, self-purchase, or collecting. Little Books may be small in size, but they're big in titles and sales."
410,0836217039,10.0,The Indispensable Calvin and Hobbes: A Calvin and Hobbes Treasury,Bill Watterson,1992,Andrews McMeel Pub,http://images.amazon.com/images/P/0836217039.01.THUMBZZZ.jpg,http://images.amazon.com/images/P/0836217039.01.MZZZZZZZ.jpg,http://images.amazon.com/images/P/0836217039.01.LZZZZZZZ.jpg,
411,0836217713,10.0,Homicidal Psycho Jungle Cat,Bill Watterson,1994,Andrews McMeel Publishing,http://images.amazon.com/images/P/0836217713.01.THUMBZZZ.jpg,http://images.amazon.com/images/P/0836217713.01.MZZZZZZZ.jpg,http://images.amazon.com/images/P/0836217713.01.LZZZZZZZ.jpg,A collection of black-and-white and color comic strips featuring the rambunctious little boy Calvin and his tiger Hobbes.
412,0836218094,10.0,Essential Calvin And Hobbes Hd,Bill Watterson,1988,Andrews McMeel Publishing,http://images.amazon.com/images/P/0836218094.01.THUMBZZZ.jpg,http://images.amazon.com/images/P/0836218094.01.MZZZZZZZ.jpg,http://images.amazon.com/images/P/0836218094.01.LZZZZZZZ.jpg,
413,0836252039,10.0,This Woman Deserves A Party-M. Engelbreit,Mary Engelbreit,1998,Andrews McMeel Publishing,http://images.amazon.com/images/P/0836252039.01.THUMBZZZ.jpg,http://images.amazon.com/images/P/0836252039.01.MZZZZZZZ.jpg,http://images.amazon.com/images/P/0836252039.01.LZZZZZZZ.jpg,Life doles out certain universal experiences. Mary Engelbreit has charmed millions of people with her ability to capture those moments in her art and communicate the feelings that accompany them.
414,0836249348,10.0,Cc Nutcracker,E.T.A. Hoffman,1991,Andrews McMeel Publishing,http://images.amazon.com/images/P/0836249348.01.THUMBZZZ.jpg,http://images.amazon.com/images/P/0836249348.01.MZZZZZZZ.jpg,http://images.amazon.com/images/P/0836249348.01.LZZZZZZZ.jpg,"After hearing how her toy nutcracker got his ugly face, a little girl helps break the spell and watches him change into a handsome prince."
415,0836249011,10.0,Cc Little Red Riding Hood (Children's Classics (Andrews McMeel)),Jennifer Greenway,1992,Andrews McMeel Publishing,http://images.amazon.com/images/P/0836249011.01.THUMBZZZ.jpg,http://images.amazon.com/images/P/0836249011.01.MZZZZZZZ.jpg,http://images.amazon.com/images/P/0836249011.01.LZZZZZZZ.jpg,A little girl meets a hungry wolf in the forest while on her way to visit her grandmother.
416,0836246276,10.0,Mary Engelbreit'S Christmas Companion,Mary Engelbreit,1995,Andrews McMeel Publishing,http://images.amazon.com/images/P/0836246276.01.THUMBZZZ.jpg,http://images.amazon.com/images/P/0836246276.01.MZZZZZZZ.jpg,http://images.amazon.com/images/P/0836246276.01.LZZZZZZZ.jpg,"The beloved children's illustrator offers a lavish, detailed compendium of home-decorating tips and ideas for the Christmas holiday, the second volume in her popular series of home design books, featuring sparkling full-color photographs."
417,0836246217,10.0,Mary Engelbreit'S Home Companion Book,Mary Engelbreit,1994,Andrews McMeel Publishing,http://images.amazon.com/images/P/0836246217.01.THUMBZZZ.jpg,http://images.amazon.com/images/P/0836246217.01.MZZZZZZZ.jpg,http://images.amazon.com/images/P/0836246217.01.LZZZZZZZ.jpg,"Illustrations, photographs, and simple text provide ideas for home decoration."
418,0836246071,10.0,Believe,Mary Engelbreit,1993,Andrews McMeel Publishing,http://images.amazon.com/images/P/0836246071.01.THUMBZZZ.jpg,http://images.amazon.com/images/P/0836246071.01.MZZZZZZZ.jpg,http://images.amazon.com/images/P/0836246071.01.LZZZZZZZ.jpg,
419,0836236777,10.0,Claus And Effect,Mary Engelbreit,1997,Andrews McMeel Publishing,http://images.amazon.com/images/P/0836236777.01.THUMBZZZ.jpg,http://images.amazon.com/images/P/0836236777.01.MZZZZZZZ.jpg,http://images.amazon.com/images/P/0836236777.01.LZZZZZZZ.jpg,"The warmth and whimsy of Mary Engelbreit's work is even better when shared with a friend -- and Mary's gift books from Andrews McMeel Publishing are the perfect way to spread the joy. This hot-selling line of 17 gift books includes titles covering friendship, marriage, birthdays, motherhood, and more."
420,0836236092,10.0,Wolves: : The Howl Of The Wild (Little Books (Andrews &amp; McMeel)),Mark Hoff,1997,Andrews McMeel Publishing,http://images.amazon.com/images/P/0836236092.01.THUMBZZZ.jpg,http://images.amazon.com/images/P/0836236092.01.MZZZZZZZ.jpg,http://images.amazon.com/images/P/0836236092.01.LZZZZZZZ.jpg,
421,0836230787,10.0,Gb Scorpio,Teresa Celsi,1994,Andrews McMeel Publishing,http://images.amazon.com/images/P/0836230787.01.THUMBZZZ.jpg,http://images.amazon.com/images/P/0836230787.01.MZZZZZZZ.jpg,http://images.amazon.com/images/P/0836230787.01.LZZZZZZZ.jpg,It's in the stars and in the numbers: This series sells well year-round and in all markets.
422,0836230701,10.0,Gb Aries,Teresa Celsi,1994,Andrews McMeel Publishing,http://images.amazon.com/images/P/0836230701.01.THUMBZZZ.jpg,http://images.amazon.com/images/P/0836230701.01.MZZZZZZZ.jpg,http://images.amazon.com/images/P/0836230701.01.LZZZZZZZ.jpg,
423,0836230175,10.0,Dogs (Andrews and Mcmeel Gift Books),Armand Eisen,1992,Andrews McMeel Publishing,http://images.amazon.com/images/P/0836230175.01.THUMBZZZ.jpg,http://images.amazon.com/images/P/0836230175.01.MZZZZZZZ.jpg,http://images.amazon.com/images/P/0836230175.01.LZZZZZZZ.jpg,
424,0836230140,10.0,Astrology: (Charmed Little Books),Not Applicable (Na ),1992,Andrews McMeel Publishing,http://images.amazon.com/images/P/0836230140.01.THUMBZZZ.jpg,http://images.amazon.com/images/P/0836230140.01.MZZZZZZZ.jpg,http://images.amazon.com/images/P/0836230140.01.LZZZZZZZ.jpg,
425,0836230094,10.0,Love: : A Book Of Poetry (Little Books (Andrews &amp; McMeel)),Armand Eisen,1992,Andrews McMeel Publishing,http://images.amazon.com/images/P/0836230094.01.THUMBZZZ.jpg,http://images.amazon.com/images/P/0836230094.01.MZZZZZZZ.jpg,http://images.amazon.com/images/P/0836230094.01.LZZZZZZZ.jpg,"Designed to generate impulse sales, titles in this line are carefully balanced for gift giving, self-purchase, or collecting. Little Books may be small in size, but they're big in titles and sales."
426,0836230043,10.0,God's Love (Andrews and Mcmeel Gift Books),Ariel Books,1992,Andrews McMeel Publishing,http://images.amazon.com/images/P/0836230043.01.THUMBZZZ.jpg,http://images.amazon.com/images/P/0836230043.01.MZZZZZZZ.jpg,http://images.amazon.com/images/P/0836230043.01.LZZZZZZZ.jpg,"Designed to generate impulse sales, titles in this line are carefully balanced for gift giving, self-purchase, or collecting. Little Books may be small in size, but they're big in titles and sales."
427,0836229576,10.0,Tt Pop-Up Love,David Sheldon,1997,Andrews McMeel Publishing,http://images.amazon.com/images/P/0836229576.01.THUMBZZZ.jpg,http://images.amazon.com/images/P/0836229576.01.MZZZZZZZ.jpg,http://images.amazon.com/images/P/0836229576.01.LZZZZZZZ.jpg,"Love makes the world to 'round, and this Tiny Tome pop-up book engaginly celebrates its magical, mysterious force."
428,0836229533,10.0,Happy Birthday! A Pop-up Book (Tiny Tome Pop-Up Books),Steve Henry,1997,Andrews McMeel Publishing,http://images.amazon.com/images/P/0836229533.01.THUMBZZZ.jpg,http://images.amazon.com/images/P/0836229533.01.MZZZZZZZ.jpg,http://images.amazon.com/images/P/0836229533.01.LZZZZZZZ.jpg,"Designed to emulate traditional, full-sized books, the fashions of classic bookmaking -- full-color throughout, stylized endpapers, fine quality paper, full-length text, and Smyth-sewn binding -- are represented in this line. They're tiny in size but gigantic in popularity. Based on some of our best-selling gift topics, these Pop-up Books are a must-buy item for millions of gift givers. Each spread contains a lavishly drawn, movable design with quotes or prose for entertainment and enlightenment."
429,0836227700,10.0,Time For Tea With Mary Engelbreit (Home Companion Series),Mary Engelbreit,1997,Andrews McMeel Publishing,http://images.amazon.com/images/P/0836227700.01.THUMBZZZ.jpg,http://images.amazon.com/images/P/0836227700.01.MZZZZZZZ.jpg,http://images.amazon.com/images/P/0836227700.01.LZZZZZZZ.jpg,
430,0836225236,10.0,Cathy Twentieth Anniversary Collection,Cathy Guisewite,1996,Andrews McMeel Publishing,http://images.amazon.com/images/P/0836225236.01.THUMBZZZ.jpg,http://images.amazon.com/images/P/0836225236.01.MZZZZZZZ.jpg,http://images.amazon.com/images/P/0836225236.01.LZZZZZZZ.jpg,"""For years, Guisewite has presented a sampling of the absurd and achingly familiar rituals women face in presenting themselves to the world. In the process, she has become a dead-on chronicler of fashion in all its folly."" --The Dallas Morning News Lovable Cathy has been sister, confidante, and best friend to countless fans around the world. She's an Everywoman who experiences frustrations on the job, in her love life, and with her aging parents in much the same way as her real-life counterparts. Yet Cathy always handles everything with aplomb, consistently seeing the funny side of every situation. She's been an inspiration--giving readers infinite reasons to laugh at life's strange realities. In this celebration of Cathy's 20 years, creator Guisewite shares some of her earliest strips and recollections of Cathy's growth. An advertising copywriter when she first drew the frazzled Cathy in 1976, Guisewite also reflects on how her own life shaped her character and the strip's other personalities--from boyfriends to pets to parents. From fashion challenges to business travel, Guisewite has covered the gamut of life through her indomitable alter-ego, Cathy, and the trip's been pleasurable for everyone. In Cathy's 20th Anniversary Collection, readers also accompany Cathy on more adventures: Cathy as she listens patiently to her boss rant about how to buy a new car, replying, ""Where""s this energy when we want a man to go in a mall?"" Cathy as she turns her mother to mush by asking for quality time. Cathy, frustrated from years of trying to find the right man, as she buys a computer just for the on-line romance chat rooms. Faithful fans who've grown up with Cathy will treasure this 20th anniversary book from Cathy Guisewite."
431,0836222997,10.0,Home Is Where The Heart Is (Main Street Editions Gift Books),Mary Engelbreit,1996,Andrews McMeel Publishing,http://images.amazon.com/images/P/0836222997.01.THUMBZZZ.jpg,http://images.amazon.com/images/P/0836222997.01.MZZZZZZZ.jpg,http://images.amazon.com/images/P/0836222997.01.LZZZZZZZ.jpg,
432,0836221281,10.0,Better Or For Worse Love Just Screws Everything Up,Lynn Johnston,1996,Andrews McMeel Publishing,http://images.amazon.com/images/P/0836221281.01.THUMBZZZ.jpg,http://images.amazon.com/images/P/0836221281.01.MZZZZZZZ.jpg,http://images.amazon.com/images/P/0836221281.01.LZZZZZZZ.jpg,
433,0836218485,10.0,FoxTrot the Works,Bill Amend,1990,Andrews McMeel Publishing,http://images.amazon.com/images/P/0836218485.01.THUMBZZZ.jpg,http://images.amazon.com/images/P/0836218485.01.MZZZZZZZ.jpg,http://images.amazon.com/images/P/0836218485.01.LZZZZZZZ.jpg,"In this treasury edition of the first two Fox Trot books, Fox Trot and Pass the Loot, all the daily strips and color Sundays are collected in one large volume for Fox Trot fans everywhere."
434,083480087X,10.0,Human Revolution,Daisaku Ikeda,1974,Weatherhill,http://images.amazon.com/images/P/083480087X.01.THUMBZZZ.jpg,http://images.amazon.com/images/P/083480087X.01.MZZZZZZZ.jpg,http://images.amazon.com/images/P/083480087X.01.LZZZZZZZ.jpg,"Chronicles the efforts of Jōsei Toda, the second president of the Soka Gakkai, to construct this Buddhist organization upon his release from Sugamo Prison at the end of World War II."
435,0834800748,10.0,The Human Revolution.,Daisaku Ikeda,1973,Weatherhill,http://images.amazon.com/images/P/0834800748.01.THUMBZZZ.jpg,http://images.amazon.com/images/P/0834800748.01.MZZZZZZZ.jpg,http://images.amazon.com/images/P/0834800748.01.LZZZZZZZ.jpg,
436,0820317594,10.0,A Childhood: The Biography of a Place,Harry Crews,1995,University of Georgia Press,http://images.amazon.com/images/P/0820317594.01.THUMBZZZ.jpg,http://images.amazon.com/images/P/0820317594.01.MZZZZZZZ.jpg,http://images.amazon.com/images/P/0820317594.01.LZZZZZZZ.jpg,"Harry Crew recounts his childhood, focusing on the people, places, and circumstances that shaped him into the author he is today."
437,0830716076,10.0,What the Bible Is All About: Niv,Henrietta C. Mears,1993,Gospel Light Pubns,http://images.amazon.com/images/P/0830716076.01.THUMBZZZ.jpg,http://images.amazon.com/images/P/0830716076.01.MZZZZZZZ.jpg,http://images.amazon.com/images/P/0830716076.01.LZZZZZZZ.jpg,
438,0831711434,10.0,Dream Desserts: Spectacular Recipes for Delicious Desserts,Linda Fraser,1995,Smithmark Publishers,http://images.amazon.com/images/P/0831711434.01.THUMBZZZ.jpg,http://images.amazon.com/images/P/0831711434.01.MZZZZZZZ.jpg,http://images.amazon.com/images/P/0831711434.01.LZZZZZZZ.jpg,
439,0831706899,10.0,The Birthday Book,Jane Newdick,1995,Smithmark Publishers,http://images.amazon.com/images/P/0831706899.01.THUMBZZZ.jpg,http://images.amazon.com/images/P/0831706899.01.MZZZZZZZ.jpg,http://images.amazon.com/images/P/0831706899.01.LZZZZZZZ.jpg,"A date book provides spaces for recording important events and includes listings of celebrity birthdays, horoscope descriptions, a Chinese astrology chart, an anniversary gift list, and accompanying floral illustrations."
440,0831400137,10.0,Conjoint Family Therapy Rev Edition,Virginia Satir,1983,Science Behavior@books Inc,http://images.amazon.com/images/P/0831400137.01.THUMBZZZ.jpg,http://images.amazon.com/images/P/0831400137.01.MZZZZZZZ.jpg,http://images.amazon.com/images/P/0831400137.01.LZZZZZZZ.jpg,
441,0830823123,10.0,Tolkien's Ordinary Virtues : Exploring the Spiritual Themes of the Lord of the Rings,Mark Eddy Smith,2002,InterVarsity Press,http://images.amazon.com/images/P/0830823123.01.THUMBZZZ.jpg,http://images.amazon.com/images/P/0830823123.01.MZZZZZZZ.jpg,http://images.amazon.com/images/P/0830823123.01.LZZZZZZZ.jpg,"For Christians who are fans of Tolkien, Smith compares the tales of the Hobbits to those of spirituality, wherein God calls those that listen to embark on a journey."
442,0830819797,10.0,When God Interrupts: Finding New Life Through Unwanted Change,M. Craig Barnes,1996,InterVarsity Press,http://images.amazon.com/images/P/0830819797.01.THUMBZZZ.jpg,http://images.amazon.com/images/P/0830819797.01.MZZZZZZZ.jpg,http://images.amazon.com/images/P/0830819797.01.LZZZZZZZ.jpg,"Craig Barnes shares how during times of change and seeming abandonment, God is right at our side offering a new direction, offering us new life."
443,0830819096,10.0,7 Myths About Christianity,Dale Larsen,1998,InterVarsity Press,http://images.amazon.com/images/P/0830819096.01.THUMBZZZ.jpg,http://images.amazon.com/images/P/0830819096.01.MZZZZZZZ.jpg,http://images.amazon.com/images/P/0830819096.01.LZZZZZZZ.jpg,
444,0830813225,10.0,An Earth-Careful Way of Life: Christian Stewardship and the Environmental Crisis,Lionel Basney,1994,Intervarsity Pr,http://images.amazon.com/images/P/0830813225.01.THUMBZZZ.jpg,http://images.amazon.com/images/P/0830813225.01.MZZZZZZZ.jpg,http://images.amazon.com/images/P/0830813225.01.LZZZZZZZ.jpg,
445,0830727892,10.0,How to Be a Christian Without Being Religious: Discover the Joy of Being Free in Your Faith: A User-Friendly Study of Romans,Fritz Ridenour,2002,Regal Books,http://images.amazon.com/images/P/0830727892.01.THUMBZZZ.jpg,http://images.amazon.com/images/P/0830727892.01.MZZZZZZZ.jpg,http://images.amazon.com/images/P/0830727892.01.LZZZZZZZ.jpg,
446,0830726446,10.0,Intercessors - Discover Your Prayer Power,Elizabeth Alves,2000,Regal Books,http://images.amazon.com/images/P/0830726446.01.THUMBZZZ.jpg,http://images.amazon.com/images/P/0830726446.01.MZZZZZZZ.jpg,http://images.amazon.com/images/P/0830726446.01.LZZZZZZZ.jpg,
447,0830725334,10.0,"Communication: Key to Your Marriage : A Practical Guide to Creaing a Happy, Fulfilling Relationship",H. Norman Wright,2000,Regal Books,http://images.amazon.com/images/P/0830725334.01.THUMBZZZ.jpg,http://images.amazon.com/images/P/0830725334.01.MZZZZZZZ.jpg,http://images.amazon.com/images/P/0830725334.01.LZZZZZZZ.jpg,"Many specialists in family relations say the number-one problem in marriages today is not sex, money or children, but lack of communication between husband and wife. H. Norman Wright tackles this dilemma in the Christian book on couples communication. Presenting insightful ways to reduce marital conflict, manage anger, build one another's self-esteem and just plain listen to one another, Wright provides couples with the resources to understand each other at new and deeper levels. Ideal for married and pre-married couples, counselors, lay counselors, mentors and pastors, this classic has been fully revised and updated for marriages in the new millennium."
448,0830709258,10.0,Eternity in Their Hearts:Startling Evidence of Belief in the One True God in Hundreds of Cultures Throughout the World,"Don, Richardson",1984,Regal Books,http://images.amazon.com/images/P/0830709258.01.THUMBZZZ.jpg,http://images.amazon.com/images/P/0830709258.01.MZZZZZZZ.jpg,http://images.amazon.com/images/P/0830709258.01.LZZZZZZZ.jpg,"Anyone who has been awed by Machu Picchu's splendor will want to read how Pachacuti, the Inca king who founded it, accomplished something far more significant than merely building fortresses, temples or monuments. His story is yet another example of how the concept of a supreme God has existed for centuries in hundreds of cultures throughout the world. This and twenty-five other incredible-but-true stories prove the truth of the words of Ecclesiastes."
449,0834300532,10.0,"Sesame Street Treasury Volume 1 (Sesame Street Treasury, Volume 1)",Linda Bove,1983,Random House,http://images.amazon.com/images/P/0834300532.01.THUMBZZZ.jpg,http://images.amazon.com/images/P/0834300532.01.MZZZZZZZ.jpg,http://images.amazon.com/images/P/0834300532.01.LZZZZZZZ.jpg,Sesame Street Muppets starring the Number 1 and the letter A.
450,0830655018,10.0,"Calligraphy Tips, First Edition",Bill Gray,1989,Design Press,http://images.amazon.com/images/P/0830655018.01.THUMBZZZ.jpg,http://images.amazon.com/images/P/0830655018.01.MZZZZZZZ.jpg,http://images.amazon.com/images/P/0830655018.01.LZZZZZZZ.jpg,
451,083063360X,10.0,Gordon McComb's Gadgeteers Goldmine,Gordon  McComb,1990,McGraw-Hill/TAB Electronics,http://images.amazon.com/images/P/083063360X.01.THUMBZZZ.jpg,http://images.amazon.com/images/P/083063360X.01.MZZZZZZZ.jpg,http://images.amazon.com/images/P/083063360X.01.LZZZZZZZ.jpg,
452,0830631380,10.0,Encyclopedia of Electronic Circuits Volume 2,Rudolf F. Graf,1988,McGraw-Hill/TAB Electronics,http://images.amazon.com/images/P/0830631380.01.THUMBZZZ.jpg,http://images.amazon.com/images/P/0830631380.01.MZZZZZZZ.jpg,http://images.amazon.com/images/P/0830631380.01.LZZZZZZZ.jpg,"This fourth volume in a series that has sold more than 175,000 copies, includes schematics and descriptions for the latest circuitry used in computers, controls, instrumentation, telecommunications, sensors, and numerous other electronics applications. A companion to previous volumes, this work features more than 1000 all-new curcuits in 100 alphabetically-arranged categories."
453,0830628460,10.0,The World's Greatest Paper Airplane and Toy Book,Keith R. Laux,1987,McGraw-Hill Professional,http://images.amazon.com/images/P/0830628460.01.THUMBZZZ.jpg,http://images.amazon.com/images/P/0830628460.01.MZZZZZZZ.jpg,http://images.amazon.com/images/P/0830628460.01.LZZZZZZZ.jpg,"This amazing book has every possible airplane design from stunt plane to glider, from the normal dart, to the X-Wing. You don't need fancy paper to execute and you can also learn to make ninja stars and frogs, helicopters, and a pac-man head. If you love paper planes, get this book!"
454,0830613935,10.0,Radio Communications Receivers,Cornell Drentea,1982,McGraw-Hill,http://images.amazon.com/images/P/0830613935.01.THUMBZZZ.jpg,http://images.amazon.com/images/P/0830613935.01.MZZZZZZZ.jpg,http://images.amazon.com/images/P/0830613935.01.LZZZZZZZ.jpg,
455,0829813500,10.0,Liberating Christ: Exploring the Christologies of Contemporary Liberation Movements,Lisa Isherwood,1999,United Church Press,http://images.amazon.com/images/P/0829813500.01.THUMBZZZ.jpg,http://images.amazon.com/images/P/0829813500.01.MZZZZZZZ.jpg,http://images.amazon.com/images/P/0829813500.01.LZZZZZZZ.jpg,"Liberating Christ examines the various trajectories within the broad liberation framework for understanding the person and work of Jesus. Lisa Isherwood draws out the common themes found in liberation theologies, especially the use of class-race-gender analysis, as well as the distinctive understandings of Jesus within these theologies. In this wonderfully constructed introduction to liberation Christology, Isherwood surveys liberation theologies and the evolution of a Christology for our time -- a Christology that hopes to reclaim Christ from death by doctrinal fossilization."
456,0829723951,10.0,"Santa Biblia (Nueva VersiÃ³n Internacional, ediciÃ³n rÃºstica)",International Bible Society,1999,Por la Sociedad BÃ­blica Internacional para Editorial Vida,http://images.amazon.com/images/P/0829723951.01.THUMBZZZ.jpg,http://images.amazon.com/images/P/0829723951.01.MZZZZZZZ.jpg,http://images.amazon.com/images/P/0829723951.01.LZZZZZZZ.jpg,"New International Version Bible, in Spanish."
457,0829419578,10.0,In All Things: Everyday Prayers of Jesuit High School Students,Michael J. Daley,2003,Loyola Press,http://images.amazon.com/images/P/0829419578.01.THUMBZZZ.jpg,http://images.amazon.com/images/P/0829419578.01.MZZZZZZZ.jpg,http://images.amazon.com/images/P/0829419578.01.LZZZZZZZ.jpg,
458,0829417729,10.0,Mystics and Miracles: True Stories of Lives Touched by God,Bert Ghezzi,2002,Loyola Press,http://images.amazon.com/images/P/0829417729.01.THUMBZZZ.jpg,http://images.amazon.com/images/P/0829417729.01.MZZZZZZZ.jpg,http://images.amazon.com/images/P/0829417729.01.LZZZZZZZ.jpg,
459,0829414452,10.0,"Genesis: God Makes a Start (Catholic Perspectives- 6 Weeks With the Bible, 5)",Kevin Perrotta,2001,Loyola Press,http://images.amazon.com/images/P/0829414452.01.THUMBZZZ.jpg,http://images.amazon.com/images/P/0829414452.01.MZZZZZZZ.jpg,http://images.amazon.com/images/P/0829414452.01.LZZZZZZZ.jpg,"The story of creation can be difficult to understand if we do not read it properly. Genesis 1-11: God Makes a Start helps Bible-study participants put the creation story in its proper historical, cultural, and theological contexts, and goes beyond the story of creation to discuss the first sin and God's starting over with the flood. In the end, we come to see the story of creation--and re-creation--as part of God's ongoing story with us today. A Guided Discovery of the Bible The Bible invites us to explore God's word and reflect on how we might respond to it. To do this, we need guidance and the right tools for discovery. The Six Weeks with the Bible series of Bible discussion guides offers both in a concise six-week format. Whether focusing on a specific biblical book or exploring a theme that runs throughout the Bible, these practical guides in this series provide meaningful insights that explain Scripture while helping readers make connections to their own lives. Each guide * is faithful to Church teaching and is guided by sound biblical scholarship * presents the insights of Church fathers and saints * includes questions for discussion and reflection * delivers information in a reader-friendly format * gives suggestions for prayer that help readers respond to God's word * appeals to beginners as well as to advanced students of the Bible By reading Scripture, reflecting on its deeper meanings, and incorporating it into our daily life, we can grow not only in our understanding of God's word, but also in our relationship with God."
460,0831713631,10.0,Traditional Fairy Tales (Childrens Treasury),Margaret Tarrant,1990,Popular Culture Ink,http://images.amazon.com/images/P/0831713631.01.THUMBZZZ.jpg,http://images.amazon.com/images/P/0831713631.01.MZZZZZZZ.jpg,http://images.amazon.com/images/P/0831713631.01.LZZZZZZZ.jpg,
461,0831716762,10.0,Concise Illustrated Book of Seashells,Solene T. Morris,1990,Smithmark Publishers,http://images.amazon.com/images/P/0831716762.01.THUMBZZZ.jpg,http://images.amazon.com/images/P/0831716762.01.MZZZZZZZ.jpg,http://images.amazon.com/images/P/0831716762.01.LZZZZZZZ.jpg,"Describes the classification, size, habitat, physical characteristics, and location of forty seashells of the Atlantic and Pacific Coasts of North America, and the Caribbean"
462,0831716991,10.0,Complete Works of William Shakespeare,William Shakespeare,1989,Smithmark Publishers,http://images.amazon.com/images/P/0831716991.01.THUMBZZZ.jpg,http://images.amazon.com/images/P/0831716991.01.MZZZZZZZ.jpg,http://images.amazon.com/images/P/0831716991.01.LZZZZZZZ.jpg,"Contains thirty-seven plays, poems and sonnets of Shakespeare."
